{
  "schema_version": "1.0",
  "document_type": "quiz",
  "generated_at": "2023-10-27T10:00:00Z",
  "title": "Functions",
  "course": "Mathematics",
  "level": "Beginner",
  "type": "Self-Assessment Quiz",
  "metadata": {
    "time": "15",
    "total_marks": 57,
    "total_questions": 15
  },
  "instructions": [
    "Attempt all questions on your own before checking the answer key.",
    "Note any topics where you struggled and revisit them.",
    "Symbols and variables carry their standard meanings."
  ],
  "sections": [
    {
      "section_letter": "A",
      "section_title": "Multiple Choice Questions",
      "question_type": "multiple_choice",
      "questions_count": 6,
      "marks_per_question": 3,
      "total_section_marks": 18,
      "questions": [
        {
          "question_number": 1,
          "question_text": "Which of the following relations represents a function?",
          "options": [
            {
              "letter": "A",
              "text": "$\\{(1,2), (2,3), (1,4)\\}$"
            },
            {
              "letter": "B",
              "text": "$\\{(1,2), (2,2), (3,2)\\}$"
            },
            {
              "letter": "C",
              "text": "$\\{(2,1), (2,2), (3,3)\\}$"
            },
            {
              "letter": "D",
              "text": "$\\{(x,y) \\mid x^2 + y^2 = 1\\}$"
            }
          ],
          "correct_answer": "B",
          "explanation": "A relation is a function if each input (x-value) corresponds to exactly one output (y-value). Option A has '1' mapping to '2' and '4'. Option C has '2' mapping to '1' and '2'. Option D represents a circle, where for most x-values, there are two y-values. Option B satisfies the function definition as each x-value is unique or maps to a single y-value.",
          "marks": 3
        },
        {
          "question_number": 2,
          "question_text": "What is the domain of the function $f(x) = \\sqrt{x-3}$?",
          "options": [
            {
              "letter": "A",
              "text": "$x > 3$"
            },
            {
              "letter": "B",
              "text": "$x \\ge 3$"
            },
            {
              "letter": "C",
              "text": "$x < 3$"
            },
            {
              "letter": "D",
              "text": "$x \\le 3$"
            }
          ],
          "correct_answer": "B",
          "explanation": "For the square root function $f(x) = \\sqrt{g(x)}$ to be defined in real numbers, the expression under the square root, $g(x)$, must be non-negative. Therefore, we must have $x-3 \\ge 0$, which implies $x \\ge 3$. This means the domain includes all real numbers greater than or equal to 3.",
          "marks": 3
        },
        {
          "question_number": 3,
          "question_text": "If $f(x) = 2x + 1$, what is $f(5)$?",
          "options": [
            {
              "letter": "A",
              "text": "6"
            },
            {
              "letter": "B",
              "text": "7"
            },
            {
              "letter": "C",
              "text": "10"
            },
            {
              "letter": "D",
              "text": "11"
            }
          ],
          "correct_answer": "D",
          "explanation": "To find $f(5)$, substitute $x=5$ into the function definition. So, $f(5) = 2(5) + 1$. This simplifies to $10 + 1 = 11$. Therefore, the value of the function at $x=5$ is 11.",
          "marks": 3
        },
        {
          "question_number": 4,
          "question_text": "Which of the following graphs represents a function?",
          "options": [
            {
              "letter": "A",
              "text": "A vertical line"
            },
            {
              "letter": "B",
              "text": "A horizontal line"
            },
            {
              "letter": "C",
              "text": "A circle"
            },
            {
              "letter": "D",
              "text": "An ellipse"
            }
          ],
          "correct_answer": "B",
          "explanation": "According to the vertical line test, a graph represents a function if and only if every vertical line intersects the graph at most once. A vertical line fails this test immediately. A circle and an ellipse also fail the test as many vertical lines intersect them at two points. A horizontal line, however, passes the vertical line test, representing a constant function.",
          "marks": 3
        },
        {
          "question_number": 5,
          "question_text": "Given $f(x) = x^2$ and $g(x) = x+1$, what is $(f \\circ g)(x)$?",
          "options": [
            {
              "letter": "A",
              "text": "$x^2 + 1$"
            },
            {
              "letter": "B",
              "text": "$(x+1)^2$"
            },
            {
              "letter": "C",
              "text": "$x^2 + x + 1$"
            },
            {
              "letter": "D",
              "text": "$x(x+1)^2$"
            }
          ],
          "correct_answer": "B",
          "explanation": "The composition of functions $(f \\circ g)(x)$ is defined as $f(g(x))$. First, substitute $g(x)$ into $f(x)$. Since $f(x) = x^2$ and $g(x) = x+1$, we replace the $x$ in $f(x)$ with $(x+1)$. Thus, $f(g(x)) = f(x+1) = (x+1)^2$.",
          "marks": 3
        },
        {
          "question_number": 6,
          "question_text": "Which of the following functions is an odd function?",
          "options": [
            {
              "letter": "A",
              "text": "$f(x) = x^2$"
            },
            {
              "letter": "B",
              "text": "$f(x) = \\cos(x)$"
            },
            {
              "letter": "C",
              "text": "$f(x) = x^3$"
            },
            {
              "letter": "D",
              "text": "$f(x) = x^2 + x$"
            }
          ],
          "correct_answer": "C",
          "explanation": "An odd function satisfies the property $f(-x) = -f(x)$. Let's test each option: For $f(x)=x^2$, $f(-x)=(-x)^2=x^2=f(x)$, so it's even. For $f(x)=\\cos(x)$, $f(-x)=\\cos(-x)=\\cos(x)=f(x)$, so it's even. For $f(x)=x^3$, $f(-x)=(-x)^3=-x^3=-f(x)$, so it's odd. For $f(x)=x^2+x$, $f(-x)=(-x)^2+(-x)=x^2-x$, which is neither $f(x)$ nor $-f(x)$, so it's neither even nor odd.",
          "marks": 3
        }
      ]
    },
    {
      "section_letter": "B",
      "section_title": "True or False Questions",
      "question_type": "true_false",
      "questions_count": 3,
      "marks_per_question": 2,
      "total_section_marks": 6,
      "questions": [
        {
          "question_number": 1,
          "question_text": "The range of the function $f(x) = x^2$ is all real numbers.",
          "correct_answer": "False",
          "explanation": "The function $f(x) = x^2$ produces non-negative output values for any real input $x$. Since the square of any real number is always greater than or equal to zero, the range of $f(x)=x^2$ is $[0, \\infty)$, not all real numbers. For example, $-1$ is not in the range.",
          "marks": 2
        },
        {
          "question_number": 2,
          "question_text": "The function $f(x) = 3x - 5$ is a linear function.",
          "correct_answer": "True",
          "explanation": "A linear function is a polynomial function of degree one, which can be written in the form $f(x) = mx + b$, where $m$ and $b$ are constants. In this case, $f(x) = 3x - 5$ fits this form with $m=3$ and $b=-5$, confirming it is indeed a linear function.",
          "marks": 2
        },
        {
          "question_number": 3,
          "question_text": "If $f(x)$ is an even function, then its graph is symmetric with respect to the y-axis.",
          "correct_answer": "True",
          "explanation": "An even function is defined by the property $f(-x) = f(x)$ for all $x$ in its domain. This means that if a point $(x, y)$ is on the graph, then the point $(-x, y)$ is also on the graph. This precisely describes symmetry with respect to the y-axis, where reflecting across the y-axis leaves the graph unchanged.",
          "marks": 2
        }
      ]
    },
    {
      "section_letter": "C",
      "section_title": "Short Answer Questions",
      "question_type": "short_answer",
      "questions_count": 3,
      "marks_per_question": 5,
      "total_section_marks": 15,
      "questions": [
        {
          "question_number": 1,
          "question_text": "Find the domain of the function $f(x) = \\frac{1}{x-4}$.",
          "correct_answer": "The domain is $\\{x \\mid x \\in \\mathbb{R}, x \\ne 4\\}$ or in interval notation $(-\\infty, 4) \\cup (4, \\infty)$.",
          "explanation": "For a rational function, the denominator cannot be zero. In this case, the denominator is $x-4$. Setting $x-4 = 0$, we find that $x=4$. Therefore, the function is undefined when $x=4$. All other real numbers are valid inputs. So, the domain is all real numbers except 4. This can be expressed as $x \\in \\mathbb{R}, x \\ne 4$ or using interval notation, $(-\\infty, 4) \\cup (4, \\infty)$.",
          "marks": 5
        },
        {
          "question_number": 2,
          "question_text": "Given $f(x) = x^2 - 3x + 2$, evaluate $f(-1)$.",
          "correct_answer": "$f(-1) = 6$",
          "explanation": "To evaluate $f(-1)$, substitute $x = -1$ into the function's expression. So, $f(-1) = (-1)^2 - 3(-1) + 2$. First, calculate the square: $(-1)^2 = 1$. Next, calculate the product: $-3(-1) = 3$. Then, sum the terms: $1 + 3 + 2 = 6$. Therefore, $f(-1) = 6$.",
          "marks": 5
        },
        {
          "question_number": 3,
          "question_text": "Determine if the function $f(x) = x^4 - 2x^2$ is even, odd, or neither.",
          "correct_answer": "The function $f(x) = x^4 - 2x^2$ is an even function.",